{"instruction_budget":64,"name":"add_cost","operation":"add-i64","purpose":"costing","schema":"joan.tool-spec.v0","tenant":"agent_alpha","tests":[{"arguments":[{"type":"i64","value":"20"},{"type":"i64","value":"22"}],"expected":{"type":"i64","value":"42"},"name":"positive"},{"arguments":[{"type":"i64","value":"-5"},{"type":"i64","value":"2"}],"expected":{"type":"i64","value":"-3"},"name":"negative"}]}
